tableName,tableExtends,columnName,label,columnType,key,required,isReadonly,description,refSchema,refTable,refBack,refLabel,defaultValue,validation,message,computed,semantics
NationalNodes,,id,ID,string,1,true,true,Unique national node ID (in most of the cases a two letter country code).,,,,,,,,,
NationalNodes,,description,Description,string,2,true,,Description,,,,,,,,,
NationalNodes,,dns,External DNS,hyperlink,,false,,If applicable the DNS of the national node’s own server.,,,,,,,,,
NationalNodes,,contact_persons,Contact Persons,ref_array,,false,,The contact person(s) with their roles,,ContactPersonsNationalNodes,,${first_name} ${last_name},,,,,
NationalNodes,,data_refresh,Data Refresh,ontology,,true,,How is the data updated?,DirectoryOntologies,DataRefreshTypes,,${label},,,,,
NationalNodes,,date_start,Date Start,date,,false,,The date the national node is included in the Directory.,,,,,,,,,
NationalNodes,,date_end,Date End,date,,false,,The date the national node is no longer included in the Directory.,,,,,,,,,
Networks,,,,,,,,"Description of the biobank and collection networks, like name, contact information and all kinds of common agreements (access policies, charters, sops).",,,,,,,,,
Networks,,id,ID,string,1,true,true,"Unique ID the network within BBMRI-ERIC based on MIABIS 2.0 standard (ISO 3166-1 alpha-2 +underscore + biobank national ID or name), prefixed with bbmri-eric:networkID: string; if biobank network is on European or higher level, EU_ prefix is to be used instead of country prefix.",,,,,,,,,
Networks,,name,Name,string,,true,,Network name.,,,,,,,,,
Networks,,acronym,Acronym,string,,false,,Network acronym.,,,,,,,,,
Networks,,description,Description,text,,true,,Network description.,,,,,,,,,
Networks,,location,Location,string,,false,,The city where the network is located.,,,,,,,,,
Networks,,latitude,Latitude,string,,false,,"Latitude of the network in the WGS84 system (the one used by GPS), positive is northern hemisphere.",,,,,,,,,
Networks,,longitude,Longitude,string,,false,,"Longitude of the network in the WGS84 system (the one used by GPS), positive is to the East of Greenwich.",,,,,,,,,
Networks,,also_known,Also Known In,ref_array,,false,,The network is also known in …,,AlsoKnownIn,,${name_system},,,,,
Networks,,url,URL,hyperlink,,false,,Network URL,,,,,,,,,
Networks,,juridical_person,Juridical Person,string,,false,,Juristic person of the network to MIABIS 2.0 - MIABIS-2.0-05.,,,,,,,,,
Networks,,contact,Contact Person,ref,,true,,Contact person of the network.,,Persons,,${email},,,,,
Networks,,common_network_elements,Common Network Elements,ontology_array,,false,,Selection of elements that are the same for all biobanks/collections within the network.,DirectoryOntologies,CommonNetworkElements,,${label},,,,,
Networks,,national_node,National Node,ref,,true,,The network originates from this national node.,,NationalNodes,,${description},,,,,
Networks,,withdrawn,Withdrawn,bool,,true,,The network is withdrawn from the Directory.,,,,,false,,,,
Persons,,,,,,,,"Information of the contact persons of a biobank, collection of network, like name, address and e-mail address.",,,,,,,,,"vcard:Kind,vcard:Individual"
Persons,,id,ID,string,1,true,true,"Unique ID of the person, prefixed with bbmri-eric:contactID:",,,,,,,,,
Persons,,title_before_name,Title before Name,string,,false,,"Title before name, values like ""prof. mr.""",,,,,,,,,
Persons,,first_name,First Name,string,,false,,First name according to MIABIS 2.0 - MIABIS-2.0-07-A.,,,,,,,,,vcard:hasGivenName
Persons,,last_name,Last Name,string,,false,,Last name according to MIABIS 2.0 - MIABIS-2.0-07-B.,,,,,,,,,vcard:hasFamilyName
Persons,,title_after_name,Title after Name,string,,false,,"Title after name, values like ""Bsc.""",,,,,,,,,
Persons,,email,Email address,email,,true,,Email address according to MIABIS 2.0 - MIABIS-2.0-07-D.,,,,,,,,,"vcard:email,vcard:hasEmail"
Persons,,phone,Phone Number,string,,false,,Phone number according to MIABIS 2.0 including international prefix (+99999999999 form with no spaces) compliant also to E.123 norm - MIABIS-2.0-07-C.,,,,,,,,,
Persons,,address,Address,text,,false,,Address according to MIABIS 2.0 - MIABIS-2.0-07-E.,,,,,,,,,
Persons,,zip,Zip code,string,,false,,ZIP or postal code according to MIABIS 2.0 - MIABIS-2.0-07-F.,,,,,,,,,
Persons,,city,City,string,,false,,City according to MIABIS 2.0 - MIABIS-2.0-07-G.,,,,,,,,,
Persons,,country,Country,ontology,,true,,Country according to MIABIS 2.0 - MIABIS-2.0-07-H.,DirectoryOntologies,Countries,,${label},,,,,
Persons,,role,Role of the Person,text,,false,,Official role of the person.,,,,,,,,,
Persons,,biobanks,Biobanks,refback,,false,true,Biobanks the person is connected to.,,Biobanks,contact,${name},,,,,
Persons,,collections,Collections,refback,,false,true,Collections the person is connected to.,,Collections,contact,${name},,,,,
Persons,,networks,Networks,refback,,false,true,Networks the person is connected to.,,Networks,contact,${name},,,,,
Persons,,national_node,National Node,ref,,true,,The person originates from this national node.,,NationalNodes,,${description},,,,,
QualityInfoServices,,,,,,,,Service Quality Information,,,,,,,,,
QualityInfoServices,,id,ID,auto_id,1,true,true,,,,,,,,,QIS-${mg_autoid},
QualityInfoServices,,service,Service,ref,,true,,,,Services,,${name},,,,,
QualityInfoServices,,qualityStandard,Quality Standard,ontology,,true,,,DirectoryOntologies,QualityStandards,,${label},,,,,
QualityInfoServices,,assessmentLevel,Assessment Level,ontology,,true,,,DirectoryOntologies,AssessmentLevels,,${label},,,,,
QualityInfoServices,,certificationNumber,Certification Number,string,,false,,,,,,,,,,,
QualityInfoServices,,certificationReport,Certification Report,hyperlink,,false,,,,,,,,,,,
QualityInfoServices,,certificationImageLink,Certification Image,hyperlink,,false,,,,,,,,,,,
Services,,,,,,,,Biobank Capabilities and Services,,,,,,,,,
Services,,id,ID,string,1,true,,"Unique ID of the service, prefixed with bbmri-eric:serviceID:",,,,,,,,,
Services,,name,Service Name,string,2,true,,Name of the service (preferably in English).,,,,,,,,,
Services,,serviceTypes,Service Types,ref_array,,true,,Related service types,DirectoryOntologies,ServiceTypes,,${label},,,,,
Services,,acronym,Acronym,string,,false,,Short name in use for the service. If applicable.,,,,,,,,,
Services,,description,Description,string,,true,,Full description of the service (in English),,,,,,,,,
Services,,descriptionUrl,Description URL,hyperlink,,false,,URL address of the service description if available.,,,,,,,,,
Services,,device,Device,string,,false,,Name of the device(s) if the service is provided with the use of them.,,,,,,,,,
Services,,deviceSystem,Device System,string,,false,,Name of a software system or platform if important for the device characteristics.,,,,,,,,,
Services,,tRL,Technology Readiness Level,ontology,,false,,Technology Readiness Level - a concept for self-assessment of the service maturity,DirectoryOntologies,TRLs,,${label},,,,,
Services,,accessDescription,Access Description,string,,true,,Description of the access policy of the service.,,,,,,,,,
Services,,accessDescriptionUrl,Access Description URL,hyperlink,,false,,URL of the service access policy if available..,,,,,,,,,
Services,,unitOfAccess,Unit of Access,string,,false,,Information about a standard unit used in calculations of costs of service provision.,,,,,,,,,
Services,,unitCost,Unit Cost,string,,false,,Cost per unit.,,,,,,,,,
Services,,qualityStandards,Quality Standards,refback,,false,true,The standards and/or technical specifications that the service is certified or accredited for.,,QualityInfoServices,service,${qualityStandard.label},,,,,
Services,,contactInformation,Contact Information,ref,,false,,Contact information for the contact person or responsible person of the service,,Persons,,,,,,,
Services,,national_node,National Node,ref,,true,,The study originates from this national node.,,NationalNodes,,${description},,,,,
Services,,biobank,Biobank,ref,,true,,"Reference to a biobank ID, to which the service belongs.",,Biobanks,,${name},,,,,
Studies,,,,,,,,Table with information about the studies in which context the collection was generated,,,,,,,,,
Studies,,id,ID,string,1,true,,"Unique ID of the study, prefixed with bbmri-eric:studyID:<id_of_the_study>",,,,,,,,,
Studies,,title,Title,text,,true,,The title of the study,,,,,,,,,
Studies,,description,Description,text,,false,,A text describing the study,,,,,,,,,
Studies,,type,Type,string,,false,,"The type of study (Observational, Interventional).",,,,,,,,,
Studies,,sex,Sex,ontology_array,,false,,"The sex of the individuals that participated to the study",DirectoryOntologies,SexTypes,,${label},,,,,
Studies,,age_low,Age Low,int,,false,,Age of youngest sample donor at time of sample donation - MIABIS-2.0-10.,,,,,,,,,
Studies,,age_high,Age High,int,,false,,Age of oldest sample donor at time of sample donation - MIABIS-2.0-11.,,,,,,,,,
Studies,,age_unit,Age Unit,ontology,,false,,"Unit defining Age Low and Age High. Can be one of the following values: YEAR, MONTH, WEEK, DAY - MIABIS-2.0-08.",DirectoryOntologies,AgeUnits,,${label},,,,,
Studies,,number_of_subjects,Number of subjects,int,,false,,"The number of subjects that participated to the study",,,,,,,,,
Studies,,also_known,Also Known In,ref_array,,false,,The study also exists in …,,AlsoKnownIn,,${name_system},,,,,
Studies,,collections,Collections,refback,,false,true,,,Collections,studies,${name},,,,,
Studies,,national_node,National Node,ref,,true,,The study originates from this national node.,,NationalNodes,,${description},,,,,