tableName,tableExtends,tableType,columnName,columnType,key,required,refSchema,refTable,refLink,refBack,refLabel,defaultValue,validation,visible,computed,semantics,profiles,label,description
Collections,,,citation requirements,text,,,,,,,,,,,,,"DataCatalogueFlat,EMA,CohortsStaging,RWEStaging,NetworksStaging,StudiesStaging,UMCGCohortsStaging",,Citation regulation for this collection
Collections,,,acknowledgements,text,,,,,,,,,,,,,"DataCatalogueFlat,CohortsStaging,RWEStaging,StudiesStaging,UMCGCohortsStaging",,Acknowledgement statement and citation regulation for this collection
Collections,,,documentation,refback,,,,Collection documentation,,collection,,,,,,,"DataCatalogueFlat,EMA,CohortsStaging,RWEStaging,NetworksStaging,StudiesStaging,UMCGCohortsStaging",,"Descriptive document(s) available for this collection, e.g. informed consent"
Collections,,,supplementary information,text,,,,,,,,,,,,,"DataCatalogueFlat,CohortsStaging,RWEStaging",,Any other information that needs to be disclosed for this collection
Collections,,,study details,heading,,,,,,,,,,,,,"DataCatalogueFlat,EMA,StudiesStaging",,List of relevant collaborations
Collections,,,collection start planned,date,,,,,,,,,,,,,"DataCatalogueFlat,EMA,StudiesStaging",,When was the data collection planned to start?
Collections,,,collection start actual,date,,,,,,,,,,,,,"DataCatalogueFlat,EMA,StudiesStaging",,When was the data collection actually start?
Collections,,,analysis start planned,date,,,,,,,,,,,,,"DataCatalogueFlat,EMA,StudiesStaging",,When was the data analysis planned to start?
Collections,,,analysis start actual,date,,,,,,,,,,,,,"DataCatalogueFlat,EMA,StudiesStaging",,When did the data analysis actually start?
Collections,,,data sources,ref_array,,,,Collections,,,,,,,,,"DataCatalogueFlat,EMA,StudiesStaging",,Data sources that provided data into this study
Collections,,,medical conditions studied,ontology_array,,,CatalogueOntologies,MedDRA,,,,,,,,,"DataCatalogueFlat,EMA,StudiesStaging",,Codes of the medical conditions studied
Collections,,,data extraction date,date,,,,,,,,,,,,,"DataCatalogueFlat,StudiesStaging",,Date on which the study data was extracted
Collections,,,study methods,heading,,,,,,,,,,,,,"DataCatalogueFlat,EMA,StudiesStaging",,Methodological aspects
Collections,,,analysis plan,text,,,,,,,,,,,,,"DataCatalogueFlat,StudiesStaging",,"A brief summary of the analysis method (e.g. risk estimation, measures of risk, internal/external validity)"
Collections,,,objectives,text,,,,,,,,,,,,,"DataCatalogueFlat,EMA,StudiesStaging",,A short description of the study objective
Collections,,,results,text,,,,,,,,,,,,,"DataCatalogueFlat,EMA,StudiesStaging",,A brief summary of the results of the study on study completion (e.g. from abstract)
Mapped collections,,,source,ref,1,true,,Collections,,,,,,,,,"DataCatalogueFlat,EMA",,Data source that is being mapped to a (common) data model
Mapped collections,,,source version,,,,,,,,,,,,,,"DataCatalogueFlat,EMA",,version of the datasource that is being mapped
Mapped collections,,,target,ref,1,true,,Collections,,,,,,,,,"DataCatalogueFlat,EMA",,model being mapped to
Mapped collections,,,target version,,,,,,,,,,,,,,"DataCatalogueFlat,EMA",,version of the model being mapped to
Mapped collections,,,cdms other,,,,,,,,,,,,,,"DataCatalogueFlat,EMA",,"if cdm is not under targets, which cdm was mapped to? (default = not applicable)"
Mapped collections,,,mapping status,ontology,,,CatalogueOntologies,Mapping status,,,,,,,,,"DataCatalogueFlat,EMA",,"Mapping from collected datasets to standard/harmonised datasets, optionally including ETL syntaxes"
Mapped collections,,,ETL frequency,int,,,,,,,,,,,,,"DataCatalogueFlat,EMA",,"The frequency of the ETL process, in months"
Mapped collections,,,ETL specification url,hyperlink,,,,,,,,,,,,,"DataCatalogueFlat,EMA",,Link to ETL specification documentation
Mapped collections,,,ETL specification document,file,,,,,,,,,,,,,"DataCatalogueFlat,EMA",,Documentation concerning ETL details
Mapped datasets,,,source,ref,1,TRUE,,Collections,,,,,,,,,"DataCatalogueFlat,CohortsStaging,RWEStaging,StudiesStaging,UMCGCohortsStaging",,Id of the collection being mapped from being mapped from
Mapped datasets,,,source dataset,ref,1,TRUE,,Collection datasets,source,,,,,,,,"DataCatalogueFlat,CohortsStaging,RWEStaging,StudiesStaging,UMCGCohortsStaging",,Name of the dataset being mapped from
Mapped datasets,,,target,ref,1,TRUE,,Collections,,,,,,,,,"DataCatalogueFlat,RWEStaging,StudiesStaging",,Network being mapped to
Mapped datasets,,,target dataset,ref,1,TRUE,,Collection datasets,target,,,,,,,,"DataCatalogueFlat,RWEStaging,StudiesStaging",,"Name of the dataset being mapped to, or harmonised with"
Mapped datasets,,,order,int,,,,,,,,,,,,,"DataCatalogueFlat,CohortsStaging,RWEStaging,StudiesStaging,UMCGCohortsStaging",,Order in which table ETLs should be executed for this source-target combination
Mapped datasets,,,description,text,,,,,,,,,,,,,"DataCatalogueFlat,CohortsStaging,RWEStaging,StudiesStaging,UMCGCohortsStaging",,Human readible description of the mapping
Mapped datasets,,,syntax,text,,,,,,,,,,,,,"DataCatalogueFlat,CohortsStaging,RWEStaging,StudiesStaging,UMCGCohortsStaging",,"Formal definition of the mapping, ideally in executable code"
Mapped variables,,,source,ref,1,TRUE,,Collections,,,,,,,,,"DataCatalogueFlat,RWEStaging,CohortsStaging,StudiesStaging,UMCGCohortsStaging",,Id of the collection that contains the source variable(s)
Mapped variables,,,source dataset,ref,1,TRUE,,Collection datasets,source,,,,,,,,"DataCatalogueFlat,RWEStaging,CohortsStaging,StudiesStaging,UMCGCohortsStaging",,Name of the dataset that contains the source variable(s)
Mapped variables,,,source variables,ref_array,,,,Variables,source dataset,,,,,,,,"DataCatalogueFlat,RWEStaging,CohortsStaging,StudiesStaging,UMCGCohortsStaging",,"Optional, source variable that was mapped from. You may also indicate that a mapping to a target variable was not done and leave this field empty (match = not available)"
Mapped variables,,,source variables other datasets,ref_array,,,,Variables,source,,,,,,,,"DataCatalogueFlat,RWEStaging,CohortsStaging,StudiesStaging,UMCGCohortsStaging",,"Optional, variables from other source datasets. Initially one may only define mapping between releases"
Mapped variables,,,target,ref,1,TRUE,,Collections,,,,,,,,,"DataCatalogueFlat,RWEStaging,StudiesStaging",,Id of the collection that contains the target variable
Mapped variables,,,target dataset,ref,1,TRUE,,Collection datasets,target,,,,,,,,"DataCatalogueFlat,RWEStaging,StudiesStaging",,Name of the dataset that contains the target variable
Mapped variables,,,target variable,ref,1,TRUE,,Variables,target dataset,,,,,,,,"DataCatalogueFlat,RWEStaging,StudiesStaging",,Target variable that was mapped to
Mapped variables,,,repeats,text,1,TRUE,,,,,,NA,,,,,"DataCatalogueFlat,RWEStaging,CohortsStaging,StudiesStaging,UMCGCohortsStaging",,"In case of mapping to a repeated variable, specify which repeats were mapped to"
Mapped variables,,,match,ontology,,TRUE,CatalogueOntologies,Status details,,,,,,,,,"DataCatalogueFlat,RWEStaging,CohortsStaging,StudiesStaging,UMCGCohortsStaging",,"Harmonisation match, i.e., complete, partial, na"
Mapped variables,,,description,text,,,,,,,,,,,,,"DataCatalogueFlat,RWEStaging,CohortsStaging,StudiesStaging,UMCGCohortsStaging",,Human readible description of the mapping
Mapped variables,,,syntax,text,,,,,,,,,,,,,"DataCatalogueFlat,RWEStaging,CohortsStaging,StudiesStaging,UMCGCohortsStaging",,"Formal definition of the mapping, ideally in executable code"
Mapped variables,,,comments,text,,,,,,,,,,,,,"DataCatalogueFlat,RWEStaging,CohortsStaging,StudiesStaging,UMCGCohortsStaging",,Additional notes or comments
Submissions,,,submission date,datetime,1,true,,,,,,,,,,,"DataCatalogueFlat,EMA",,Date of submission
Submissions,,,submitter name,,1,true,,,,,,,,,,,DataCatalogueFlat,,Name of person who submitted
Submissions,,,collections,ref_array,,true,,Collections,,,,,,,,,"DataCatalogueFlat,EMA",,Resource(s) that this submission is related to
Submissions,,,submitter email,,,true,,,,,,,,,,,DataCatalogueFlat,,Email of person who submitted
Submissions,,,submitter organisation,,,,,,,,,,,,,,DataCatalogueFlat,,Organisation of submitter
Submissions,,,submitter role,ontology,,,CatalogueOntologies,Submitter roles,,,,,,,,,DataCatalogueFlat,,Role of submitter in organisation
Submissions,,,submitter role other,text,,,,,,,,,,,,,DataCatalogueFlat,,"Role of submitter in organisation, if other than above"
Submissions,,,submission type,ontology,,,CatalogueOntologies,Submission types,,,,,,,,,"DataCatalogueFlat,EMA",,"Type of submission, e.g. 'new entry', 'correction'"
Submissions,,,submission description,text,,,,,,,,,,,,,"DataCatalogueFlat,EMA",,"Description of the submission, if applicable"
Submissions,,,responsible persons,text,,,,,,,,,,,,,DataCatalogueFlat,,List of responsible persons related to this submission
Submissions,,,acceptance date,datetime,,,,,,,,,,,,,"DataCatalogueFlat,EMA",,Date submission was accepted
Variable values,,,collection,ref,1,true,,Collections,,,,,,,,,"DataCatalogueFlat,RWEStaging,CohortsStaging,StudiesStaging,UMCGCohortsStaging,NetworksStaging",,
Variable values,,,variable,ref,1,true,,Variables,collection,,,,,,,,"DataCatalogueFlat,RWEStaging,CohortsStaging,StudiesStaging,UMCGCohortsStaging,NetworksStaging",,e.g. PATO
Variable values,,,value,,1,true,,,,,,,,,,,"DataCatalogueFlat,RWEStaging,CohortsStaging,StudiesStaging,UMCGCohortsStaging,NetworksStaging",,e.g. '1'
Variable values,,,label,,,true,,,,,,,,,,,"DataCatalogueFlat,RWEStaging,CohortsStaging,StudiesStaging,UMCGCohortsStaging,NetworksStaging",,
Variable values,,,order,int,,,,,,,,,,,,,"DataCatalogueFlat,RWEStaging,CohortsStaging,StudiesStaging,UMCGCohortsStaging,NetworksStaging",,
Variable values,,,is missing,bool,,,,,,,,,,,,,"DataCatalogueFlat,RWEStaging,CohortsStaging,StudiesStaging,UMCGCohortsStaging,NetworksStaging",,
Variable values,,,ontology term URI,,,,,,,,,,,,,,"DataCatalogueFlat,RWEStaging,CohortsStaging,StudiesStaging,UMCGCohortsStaging,NetworksStaging",,reference to ontology term that defines this categorical value
Variable values,,,since version,,,,,,,,,,,,,,"DataCatalogueFlat,RWEStaging,CohortsStaging,StudiesStaging,UMCGCohortsStaging,NetworksStaging",,When this variable value was introduced if applicable
Variable values,,,until version,,,,,,,,,,,,,,"DataCatalogueFlat,RWEStaging,CohortsStaging,StudiesStaging,UMCGCohortsStaging,NetworksStaging",,When this variable value was removed if applicable
Variables,,,collection,ref,1,TRUE,,Collections,,,,,,,,,"DataCatalogueFlat,RWEStaging,CohortsStaging,StudiesStaging,UMCGCohortsStaging,NetworksStaging",,collection that this variable is part of
Variables,,,dataset,ref,1,TRUE,,Collection datasets,collection,,,,,,,,"DataCatalogueFlat,RWEStaging,CohortsStaging,StudiesStaging,UMCGCohortsStaging,NetworksStaging",,dataset that this variable is part of
Variables,,,name,,1,TRUE,,,,,,,,,,,"DataCatalogueFlat,RWEStaging,CohortsStaging,StudiesStaging,UMCGCohortsStaging,NetworksStaging",,"name of the variable, unique within a dataset"
Variables,,,useExternalDefinition,ref,,,,Variables,,,,,,,,,"DataCatalogueFlat,RWEStaging,CohortsStaging,StudiesStaging,UMCGCohortsStaging,NetworksStaging",,refer to variable definition in other datasets
Variables,,,label,,,,,,,,,,,!useExternalDefinition,,,"DataCatalogueFlat,RWEStaging,CohortsStaging,StudiesStaging,UMCGCohortsStaging,NetworksStaging",,"human readable name, if applicable"
Variables,,,description,text,,,,,,,,,,!useExternalDefinition,,,"DataCatalogueFlat,RWEStaging,CohortsStaging,StudiesStaging,UMCGCohortsStaging,NetworksStaging",,description of the variable
Variables,,,collection event,ref_array,,,,Collection events,collection,,,,,,,,"DataCatalogueFlat,CohortsStaging,StudiesStaging,UMCGCohortsStaging",,in case of protocolised data collection this defines the moment(s) in time this variable is collected on
Variables,,,format,ontology,,,CatalogueOntologies,Formats,,,,,,!useExternalDefinition,,,"DataCatalogueFlat,RWEStaging,CohortsStaging,StudiesStaging,UMCGCohortsStaging,NetworksStaging",,"data type, e.g. string, integer, decimal, date, datetime, etc."
Variables,,,unit,ontology,,,CatalogueOntologies,Units,,,,,,!useExternalDefinition,,,"DataCatalogueFlat,RWEStaging,CohortsStaging,StudiesStaging,UMCGCohortsStaging,NetworksStaging",,"in case of a continuous variable, the unit that the variable values are expressed in"
Variables,,,since version,,,,,,,,,,,,,,"DataCatalogueFlat,RWEStaging,CohortsStaging,StudiesStaging,UMCGCohortsStaging,NetworksStaging",,when this variable was introduced
Variables,,,until version,,,,,,,,,,,,,,"DataCatalogueFlat,RWEStaging,CohortsStaging,StudiesStaging,UMCGCohortsStaging,NetworksStaging",,when this variable was removed if applicable
Variables,,,repeat unit,ontology,,,CatalogueOntologies,Variable repeat units,,,,,,,,,"DataCatalogueFlat,RWEStaging,CohortsStaging,StudiesStaging,UMCGCohortsStaging,NetworksStaging",,"the repeat unit, in case the variable was repeatedly collected over time, e.g. month or week"
Variables,,,repeat min,int,,,,,,,,,,,,,"DataCatalogueFlat,RWEStaging,CohortsStaging,StudiesStaging,UMCGCohortsStaging,NetworksStaging",,the first repeat unit
Variables,,,repeat max,int,,,,,,,,,,,,,"DataCatalogueFlat,RWEStaging,CohortsStaging,StudiesStaging,UMCGCohortsStaging,NetworksStaging",,the last repeat unit
Variables,,,example values,string_array,,,,,,,,,,!useExternalDefinition,,,"DataCatalogueFlat,RWEStaging,CohortsStaging,StudiesStaging,UMCGCohortsStaging,NetworksStaging",,example values for this variable
Variables,,,permitted values,refback,,,,Variable values,,variable,,,,!useExternalDefinition,,,"DataCatalogueFlat,RWEStaging,CohortsStaging,StudiesStaging,UMCGCohortsStaging,NetworksStaging",,"listing of variable values, filled out in Variable values table"
Variables,,,keywords,ontology_array,,,CatalogueOntologies,Keywords,,,,,,!useExternalDefinition,,,"DataCatalogueFlat,RWEStaging,CohortsStaging,StudiesStaging,UMCGCohortsStaging,NetworksStaging",,keywords that will make the variable easier to find
Variables,,,vocabularies,ontology_array,,,CatalogueOntologies,Vocabularies,,,,,,!useExternalDefinition,,,"DataCatalogueFlat,RWEStaging,CohortsStaging,StudiesStaging,UMCGCohortsStaging,NetworksStaging",,vocabularies used to express the values of this variable
Variables,,,notes,text,,,,,,,,,,!useExternalDefinition,,,"DataCatalogueFlat,RWEStaging,CohortsStaging,StudiesStaging,UMCGCohortsStaging,NetworksStaging",,any other information on this variable
Variables,,,mappings,refback,,,,Mapped variables,,target variable,,,,!useExternalDefinition,,,"DataCatalogueFlat,RWEStaging,CohortsStaging,StudiesStaging,UMCGCohortsStaging",,"listing of harmonised variables this variable was mapped to, filled out in Variable mappings table"
