tableName,tableExtends,columnName,columnType,key,required,refSchema,refTable,refLink,refBack,validation,semantics,description,profiles,visible,computed
Catalogues,,,,,,,,,,,dcat:Catalog,A collection of resources within a network or consortium or about a common topic,DataCatalogueFlat,,
Catalogues,,name,,1,TRUE,,,,,,dcterms:title,The name given to the catalogue,DataCatalogueFlat,,
Catalogues,,network,ref,1,TRUE,,Resources,,,,,Network or consortium that publishes this catalogue,DataCatalogueFlat,,
Catalogues,,type,ontology,,TRUE,CatalogueOntologies,CatalogueTypes,,,,,Type of catalogue,DataCatalogueFlat,,
Catalogues,,description,text,,TRUE,,,,,,dcterms:description,Description of this catalogue,DataCatalogueFlat,,network?.description
Catalogues,,publisher,,,,,,,,,dcterms:publisher,The organisation responsible for making the catalogue available,DataCatalogueFlat,,
