tableName,tableExtends,columnName,columnType,key,required,refSchema,refTable,refLink,refBack,validation,semantics,description,profiles,visible
DAPs,,,,,,,,,,,,Data access provider relationship where an institution can provide access to (parts of) a resource,DataCatalogueFlat,
DAPs,,organisation,ref,1,true,,Organisations,,,,,Institution that provides access,DataCatalogueFlat,
DAPs,,collection,ref,1,true,,Collections,,,,,Resource that is access or has experience with provided to,DataCatalogueFlat,
DAPs,,is data access provider,ontology_array,,,CatalogueOntologies,DAP information,,,,,"Description of population subset, data access levels, completeness, reason for access",DataCatalogueFlat,
DAPs,,reason access other,text,,,,,,,,,"If reason access is 'other', reason for being able to access (an extract of) the data source",DataCatalogueFlat,
DAPs,,population subset other,text,,,,,,,,,"If 'other' is selected above, describe the subset that can be accessed",DataCatalogueFlat,
DAPs,,process time,int,,,,,,,,,"On average, how many DAYS does it take for approval/access to be obtained following an application for data access?",DataCatalogueFlat,
