tableName,tableExtends,columnName,columnType,key,required,refSchema,refTable,refLink,refBack,validation,semantics,description,profiles,visible
Documentation,,,,,,,,,,,,Documentation attached to a resource,DataCatalogueFlat,
Documentation,,collection,ref,1,true,,Collections,,,,,The resource this documentation is for,"DataCatalogueFlat,EMA",
Documentation,,name,,1,true,,,,,,,Document name,"DataCatalogueFlat,EMA",
Documentation,,type,ontology,,,CatalogueOntologies,Document types,,,,,Type of documentation,"DataCatalogueFlat,EMA",
Documentation,,description,text,,,,,,,,,Description of the document,DataCatalogueFlat,
Documentation,,url,hyperlink,,,,,,,,,Hyperlink to the source of the documentation,"DataCatalogueFlat,EMA",
Documentation,,file,file,,,,,,,,,Optional file attachment containing the documentation,"DataCatalogueFlat,EMA",