tableName,tableExtends,columnName,columnType,key,required,refSchema,refTable,refLink,refBack,validation,semantics,description,profiles,,,,,,,,
Individual observations,,,,,,,,,,,http://purl.obolibrary.org/obo/NCIT_C25398,Findings and circumstances relating to the examination and treatment of a individual,"Patient registry, FAIR Genomes, JRC-CDE",,,,,,,,
Individual observations,,id,auto_id,1,TRUE,,,,,,,,Patient registry,,,,,,,,
Individual observations,,individual,ref,,TRUE,,Individuals,,,,http://purl.obolibrary.org/obo/IAO_0000136,A reference to the individual whom this clinical information is about,"Patient registry, FAIR Genomes, JRC-CDE",,,,,,,,
Individual observations,,date saved in database,date,,,,,,,,,,Patient registry,,,,,,,,
Individual observations,,date of observation,date,,,,,,,,http://purl.obolibrary.org/obo/NCIT_C119798,The date on which the clinical assement was made,Patient registry,,,,,,,,
Individual observations,,age at observation,period,,,,,,,,http://purl.obolibrary.org/obo/NCIT_C192236,"The age of the individual at the time of observation (e.g., ""P55Y8M12D"")","Patient registry, Beacon v2",,,,,,,,
Individual observations,,type of visit,ontology,,,Patient registry ontologies,Visit type,,,,http://purl.obolibrary.org/obo/NCIT_C103165,"The kind of visit undertaken by the individual within a study such as inpatient, outpatient, telephone, baseline, follow up, etc.","Patient registry, FAIR Genomes, JRC-CDE",,,,,,,,
Clinical observations,Individual observations,,,,,,,,,,http://purl.obolibrary.org/obo/NCIT_C87853,This table extends observations with clinical details compatible with phenopacket,Patient registry,,,,,,,,
Clinical observations,,phenotypes,refback,,,,Phenotype observations,,part of clinical observation,,http://purl.obolibrary.org/obo/NCIT_C16977,"The assemblage of traits or outward appearance of an individual. It is the product of interactions between genes and between genes and the environment. In medical context,  these are often the symptoms caused by a disease.","Patient registry, FAIR Genomes",,,,,,,,
Clinical observations,,diseases,refback,,,,Disease history,,part of clinical observation,,http://purl.obolibrary.org/obo/NCIT_C15607,"Any abnormal condition of the body or mind that causes discomfort, dysfunction, or distress to the person affected or those in contact with the person. The term is often used broadly to include injuries, disabilities, syndromes, symptoms, deviant behaviors, and atypical variations of structure and function.","Patient registry, FAIR Genomes",,,,,,,,
Clinical observations,,measurements,refback,,,,Measurements,,part of clinical observation,,http://purl.obolibrary.org/obo/NCIT_C25209,Annotation used to indicate the size or magnitude of something that was determined by comparison to a standard,"Patient registry, FAIR Genomes",,,,,,,,
Clinical observations,,molecular diagnosis gene,ontology_array,,,Patient registry ontologies,Genes,,,,http://purl.obolibrary.org/obo/NCIT_C36391,Gene affected by pathogenic variation that is causal for disease of the individual,"Patient registry, FAIR Genomes",,,,,,,,
Clinical observations,,molecular diagnosis other,text,,,,,,,,http://purl.obolibrary.org/obo/NCIT_C20826,Causal variant in HGVS notation with optional classification or free text explaining any other molecular mechanisms involved.,"Patient registry, FAIR Genomes",,,,,,,,
Clinical observations,,is solved,bool,,,,,,,,http://purl.obolibrary.org/obo/NCIT_C25587,An indication that diagnosis is given and the case is no longer considered unsolved.,Patient registry,,,,,,,,
Clinical observations,,date solved,date,,,,,,,,http://purl.obolibrary.org/obo/NCIT_C119798,"The date on which a case was considered solved (i.e., when a diagnosis was made)",Patient registry,,,,,,,,
Clinical observations,,medication,ontology_array,,,Patient registry ontologies,Medication,,,,http://purl.obolibrary.org/obo/NCIT_C459,"A drug product that contains one or more active and/or inactive ingredients used by the individual intended to treat, prevent or alleviate the symptoms of disease. Any hormone therapies, gender-related, or otherwise should also be recorded here.","Patient registry, FAIR Genomes",,,,,,,,
Clinical observations,,drug regimen,text,,,,,,,,http://purl.obolibrary.org/obo/NCIT_C142516,"The specific way a therapeutic drug is to be taken, including formulation route of administration, dose, dosing interval, and treatment duration.","Patient registry, FAIR Genomes",,,,,,,,
Clinical observations,,medical history,ontology_array,,,Patient registry ontologies,Medical history,,,,http://purl.obolibrary.org/obo/NCIT_C18772,"A record of a individual's background regarding health, occurrence of disease events and surgical procedures","Patient registry, FAIR Genomes",,,,,,,,
Clinical observations,,date of first contact,date,,,,,,,,http://purl.bioontology.org/ontology/LNC/MTHU048806,The date on which contact with the individual was initiated,"Patient registry, FAIR Genomes, JRC-CDE",,,,,,,,
Clinical observations,,date of last contact,date,,,,,,,,http://purl.obolibrary.org/obo/NCIT_C156916,The date on which contact with the individual was last made,Patient registry,,,,,,,,
Clinical observations,,classification of functioning,text,,,,,,,,http://purl.obolibrary.org/obo/NCIT_C21007,An individual's classification of functioning i.e. disability profile according to International Classification of Functioning and Disability (ICF),"Patient registry, FAIR Genomes, JRC-CDE",,,,,,,,
Clinical observations,,material used in diagnosis,text,,,,,,,,http://semanticscience.org/resource/SIO_000641,A description of one or more materials used to make a diagnosis,"Patient registry, FAIR Genomes",,,,,,,,
Phenotype observations,,,,,,,,,,,http://purl.obolibrary.org/obo/NCIT_C16977,Beacon v2 Individuals PhenotypicFeatures,"Patient registry, Beacon v2",,,,,,,,
Phenotype observations,,part of clinical observation,ref,1,TRUE,,Clinical observations,,,,http://purl.obolibrary.org/obo/NCIT_C87853,"A reference to a specific clinical observation (e.g., ""Ind001_Phen001"")","Patient registry, Beacon v2",,,,,,,,
Phenotype observations,,type,ontology,1,TRUE,Patient registry ontologies,Phenotypes,,,,http://semanticscience.org/resource/SIO_010056,"A term denoting a phenotypic feature. E.g. ""Abnormality of body height""","Patient registry, Beacon v2",,,,,,,,
Phenotype observations,,excluded,bool,,,,,,,,http://purl.obolibrary.org/obo/HP_0040285,"An indication if the phenotype was observed or not. The default is ""false"", in other words the phenotype was observed. Therefore it is only required in cases to indicate that the phenotype was looked for but found to be absent.","Patient registry, Beacon v2",,,,,,,,
Phenotype observations,,modifiers,ontology_array,,,Patient registry ontologies,Phenotypes,,,,http://purl.obolibrary.org/obo/HP_0012823,"Additional terms to characterize and specify the phenotypic abnormalities defined in the Phenotypic abnormality subontology, with respect to severity laterality, age of onset, and other aspects. E.g. Exacerbated by tobacco use","Patient registry, Beacon v2",,,,,,,,
Phenotype observations,,severity,ontology,,,Patient registry ontologies,Severity,,,,http://purl.obolibrary.org/obo/HP_0012824,"A value that describes the intensity of the phenotype (e.g., ""Profound"")","Patient registry, Beacon v2",,,,,,,,
Disease history,,,,,,,,,,,http://purl.obolibrary.org/obo/NCIT_C15607,History of diagnoses of an individual at a specific timepoints,"Patient registry, Beacon v2",,,,,,,,
Disease history,,part of clinical observation,ref,1,TRUE,,Clinical observations,,,,http://purl.obolibrary.org/obo/NCIT_C87853,"A reference to a specific clinical observation (e.g., ""Ind001_Phen001"")","Patient registry, Beacon v2",,,,,,,,
Disease history,,disease,ontology,1,TRUE,Patient registry ontologies,Diseases,,,,http://semanticscience.org/resource/SIO_001331,"The diagnosis assigned for this particular observation (e.g., ""Spinocerebellar ataxia type 34"")","Patient registry, Beacon v2",,,,,,,,
Disease history,,age group at onset,ontology,,,Patient registry ontologies,Age groups at onset,,,,"http://www.ebi.ac.uk/efo/EFO_0004847,http://purl.obolibrary.org/obo/NCIT_C20587","A categorical value that groups this individual's age of onset into groups (e.g., ""Adult"", ""18-24 years"", etc.)","Patient registry, Beacon v2",,,,,,,,
Disease history,,age of onset,period,,,,,,,,http://www.ebi.ac.uk/efo/EFO_0004847,"The age at which manifestations of the diseaese first appeared (e.g., ""P32Y6M1D"")","Patient registry, Beacon v2",,,,,,,,
Disease history,,age group at diagnosis,ontology,,,Patient registry ontologies,Age groups,,,,"http://www.ebi.ac.uk/efo/EFO_0004918,http://purl.obolibrary.org/obo/NCIT_C20587","A categorical value that groups this individual's age at diagnosis into groups (e.g., ""Adult"", ""18-24 years"", etc.)","Patient registry, Beacon v2 Vivify add-on",,,,,,,,
Disease history,,age at diagnosis,period,,,,,,,,http://www.ebi.ac.uk/efo/EFO_0004918,"The age at which the diagnosis was made (e.g., ""P32Y6M1D"")","Patient registry, Beacon v2 Vivify add-on",,,,,,,,
Disease history,,has family history,bool,,,,,,,,http://purl.obolibrary.org/obo/HP_0032316,An indication if the diagnosis is present in one or more family members or other relatives,"Patient registry, Beacon v2",,,,,,,,
Disease history,,disease severity,ontology,,,Patient registry ontologies,Severity,,,,http://purl.obolibrary.org/obo/HP_0012824,"A value that describes the intensity of the disease (e.g., ""Profound"")","Patient registry, Beacon v2",,,,,,,,
Disease history,,disease stage,ontology,,,Patient registry ontologies,Disease stage,,,,http://purl.obolibrary.org/obo/OBI_0000278,"A part of an occurrence of a disease process which is associated with position in the normal progression of the disease (e.g., ""acute onset"")","Patient registry, Beacon v2",,,,,,,,
Measurements,,,,,,,,,,,http://purl.obolibrary.org/obo/NCIT_C25209,Additional clinical measurements collected as part of the clinical observation,"Patient registry, Beacon v2",,,,,,,,
Measurements,,part of clinical observation,ref,1,TRUE,,Clinical observations,,,,http://purl.obolibrary.org/obo/NCIT_C87853,"A reference to a specific clinical observation (e.g., ""Ind001_Phen001"")","Patient registry, Beacon v2",,,,,,,,
Measurements,,code,ontology,1,TRUE,Patient registry ontologies,Analyses performed,,,,http://purl.obolibrary.org/obo/NCIT_C25162,"A unique code that identifies or categorises this measurement (e.g., ""Metabolomics"")","Patient registry, Beacon v2",,,,,,,,
Measurements,,variable,string,,,,,,,,http://purl.obolibrary.org/obo/NCIT_C54166,"A name that describes the measurement (e.g.. ""Blood platelet count"")","Patient registry,Beacon v2,Beacon v2 EMX2 add-on",,,,,,,,
Measurements,,value,int,,,,,,,,http://purl.obolibrary.org/obo/NCIT_C25712,"The value that was measured, collected, derived, etc. (e.g. ""55345"")","Patient registry, Beacon v2",,,,,,,,
Measurements,,unit,ontology,,,Patient registry ontologies,Units,,,,http://purl.obolibrary.org/obo/NCIT_C25709,"A value that specifes the measured value (e.g., ""Per Millimeter"")","Patient registry, Beacon v2",,,,,,,,