tableName,tableExtends,columnName,columnType,key,required,refSchema,refTable,refLink,refBack,validation,semantics,description,profiles
Processing,,identifier,auto_id,1,,,,,,,http://purl.obolibrary.org/obo/NCIT_C204540,"Processing identifier","RD3"
Processing,,protocol,ref,,,,Protocols,,,,,Link to the protocol that was used,RD3
Processing,,description,text,,,,,,,,,"Human readible description of the protocol used. In case of standard protocol describe deviations","RD3"
Processing,,date,datetime,,,,,,,,,"When the processing happened","RD3"
Processing,,persons involved,ref_array,,,,ContactPersons,,,,,"Who was involved in the processing","RD3"
Processing,,log,text,,,,,,,,,"Log of the process, e.g. output of the pipeline used","RD3"
Processing,,input files,ref_array,,,,Files,,,,,"links to files used as input","RD3"
Processing,,input samples,ref_array,,,,Biosamples,,,,,"links to samples used as input","RD3"
Processing,,comments,text,,,,,,,,http://purl.obolibrary.org/obo/NCIT_C25393,"A written explanation, observation or criticism added to textual material.",RD3
