tableName,tableExtends,columnName,columnType,key,required,refSchema,refTable,refLink,refBack,validation,semantics,description,profiles
Submissions,,submissionDescription,text,,,,SubmissionTypes,,,,,"Description of the submission, if applicable"
Submissions,,responsiblePersons,text,,,,,,,,,List of responsible persons related to this submission
Submissions,,acceptanceDate,datetime,,,,,,,,,Date submission was accepted
Identifiers,,resource,ref,1,TRUE,,Resources,,,,,Resource that this external identifier belongs to
Identifiers,,identifier,text,1,TRUE,,,,,,,External identifier
Identifiers,,externalIdentifierType,ontology,,,CatalogueOntologies,ExternalIdentifiers,,,,,External identifier type
Identifiers,,externalIdentifierTypeOther,text,,,,,,,,,"If other, enter external identifier type"
